{
  "domain": "character-route-content",
  "catalog_version": 1,
  "sources": [
    {
      "source_id": "SRC-001",
      "title": "甲骨文合集（摹本著录）",
      "publisher": "中华书局",
      "year": 1982,
      "locator": "第三册·走字条",
      "source_type": "著录"
    },
    {
      "source_id": "SRC-002",
      "title": "殷周金文集成（释文）",
      "publisher": "中华书局",
      "year": 1994,
      "locator": "卷五·走字器铭",
      "source_type": "著录"
    },
    {
      "source_id": "SRC-003",
      "title": "说文解字",
      "publisher": "中华书局",
      "year": 1963,
      "locator": "走部：走，趋也",
      "source_type": "字书"
    },
    {
      "source_id": "SRC-004",
      "title": "通用规范汉字字典",
      "publisher": "商务印书馆",
      "year": 2013,
      "locator": "走字条",
      "source_type": "字书"
    },
    {
      "source_id": "SRC-005",
      "title": "馆藏文物图像档案",
      "publisher": "本馆影像部",
      "year": 2024,
      "locator": "影像库·青铜器类",
      "source_type": "图像档案"
    },
    {
      "source_id": "SRC-006",
      "title": "儿童汉字认知发展研究综述",
      "publisher": "学前教育研究",
      "year": 2019,
      "locator": "第4期·表意文字教学",
      "source_type": "研究文献"
    }
  ],
  "items": [
    {
      "item_id": "走-glyph-oracle",
      "kind": "glyph",
      "character": "走",
      "title": "走·甲骨文",
      "group": "走-字形",
      "note": "",
      "current_version_id": "走-glyph-oracle-v1"
    },
    {
      "item_id": "走-glyph-bronze",
      "kind": "glyph",
      "character": "走",
      "title": "走·金文",
      "group": "走-字形",
      "note": "",
      "current_version_id": "走-glyph-bronze-v1"
    },
    {
      "item_id": "走-glyph-seal",
      "kind": "glyph",
      "character": "走",
      "title": "走·小篆",
      "group": "走-字形",
      "note": "",
      "current_version_id": "走-glyph-seal-v2"
    },
    {
      "item_id": "走-glyph-regular",
      "kind": "glyph",
      "character": "走",
      "title": "走·楷书",
      "group": "走-字形",
      "note": "",
      "current_version_id": "走-glyph-regular-v1"
    },
    {
      "item_id": "走-meaning",
      "kind": "meaning",
      "character": "走",
      "title": "走·古义",
      "group": "走-释义",
      "note": "",
      "current_version_id": "走-meaning-v1"
    },
    {
      "item_id": "走-expr-plain",
      "kind": "expression",
      "character": "走",
      "title": "走·直白版",
      "group": "走-释义表达",
      "note": "",
      "current_version_id": "走-expr-plain-v1"
    },
    {
      "item_id": "走-expr-story",
      "kind": "expression",
      "character": "走",
      "title": "走·故事版",
      "group": "走-释义表达",
      "note": "",
      "current_version_id": "走-expr-story-v1"
    },
    {
      "item_id": "走-img-ding",
      "kind": "image",
      "character": "走",
      "title": "青铜鼎铭文照片",
      "group": "走-文物图像",
      "note": "",
      "current_version_id": "走-img-ding-v1"
    },
    {
      "item_id": "走-img-rubbing",
      "kind": "image",
      "character": "走",
      "title": "拓印活动用图",
      "group": "走-拓印素材",
      "note": "",
      "current_version_id": "走-img-rubbing-v2"
    },
    {
      "item_id": "走-expr-access-10",
      "kind": "expression",
      "character": "走",
      "title": "走·触觉讲解版",
      "group": "走-释义表达",
      "note": "",
      "current_version_id": "走-expr-access-10-v1"
    }
  ],
  "versions": [
    {
      "version_id": "走-glyph-oracle-v1",
      "item_id": "走-glyph-oracle",
      "kind": "glyph",
      "version_no": 1,
      "payload": {
        "script_form": "甲骨文",
        "period": "商代晚期",
        "glyph_ref": "〔甲骨文：像人摆臂奔跑之形〕"
      },
      "source_refs": [
        {
          "source_id": "SRC-001",
          "note": "甲骨文字形出处"
        }
      ],
      "author": "内容组",
      "state": "已发布",
      "review": {
        "reviewer": "外聘文字学专家",
        "note": ""
      },
      "fingerprint": "1f2a04da77e35a8f"
    },
    {
      "version_id": "走-glyph-bronze-v1",
      "item_id": "走-glyph-bronze",
      "kind": "glyph",
      "version_no": 1,
      "payload": {
        "script_form": "金文",
        "period": "西周",
        "glyph_ref": "〔金文：人形下增“止”（脚），强调奔跑〕"
      },
      "source_refs": [
        {
          "source_id": "SRC-002",
          "note": "金文字形出处"
        }
      ],
      "author": "内容组",
      "state": "已发布",
      "review": {
        "reviewer": "外聘文字学专家",
        "note": ""
      },
      "fingerprint": "59de7bc3c2675c77"
    },
    {
      "version_id": "走-glyph-seal-v1",
      "item_id": "走-glyph-seal",
      "kind": "glyph",
      "version_no": 1,
      "payload": {
        "script_form": "小篆",
        "period": "秦",
        "glyph_ref": "〔小篆：上“夭”下“止”，线条匀圆〕"
      },
      "source_refs": [
        {
          "source_id": "SRC-003",
          "note": "小篆字形出处"
        }
      ],
      "author": "内容组",
      "state": "已归档",
      "review": {
        "reviewer": "外聘文字学专家",
        "note": ""
      },
      "fingerprint": "e06b3014b115927a"
    },
    {
      "version_id": "走-glyph-regular-v1",
      "item_id": "走-glyph-regular",
      "kind": "glyph",
      "version_no": 1,
      "payload": {
        "script_form": "楷书",
        "period": "汉魏以降",
        "glyph_ref": "走"
      },
      "source_refs": [
        {
          "source_id": "SRC-004",
          "note": "楷书字形出处"
        }
      ],
      "author": "内容组",
      "state": "已发布",
      "review": {
        "reviewer": "外聘文字学专家",
        "note": ""
      },
      "fingerprint": "f204002a84e43fe6"
    },
    {
      "version_id": "走-meaning-v1",
      "item_id": "走-meaning",
      "kind": "meaning",
      "version_no": 1,
      "payload": {
        "text": "古汉语中“走”的本义是跑、奔跑，如“走马观花”；今义“步行”是后起的。"
      },
      "source_refs": [
        {
          "source_id": "SRC-003",
          "note": "《说文》：走，趋也"
        },
        {
          "source_id": "SRC-004",
          "note": "今义对照"
        }
      ],
      "author": "内容组",
      "state": "已发布",
      "review": {
        "reviewer": "外聘文字学专家",
        "note": ""
      },
      "fingerprint": "6c43272343904689"
    },
    {
      "version_id": "走-expr-plain-v1",
      "item_id": "走-expr-plain",
      "kind": "expression",
      "version_no": 1,
      "payload": {
        "text": "三千年前，“走”是奔跑的意思。古人看到快跑的人，就画下了这个字。",
        "age_band": "7-9"
      },
      "source_refs": [
        {
          "source_id": "SRC-003",
          "note": "释义依据"
        },
        {
          "source_id": "SRC-006",
          "note": "适龄改写依据"
        }
      ],
      "author": "内容组",
      "state": "已发布",
      "review": {
        "reviewer": "外聘文字学专家",
        "note": ""
      },
      "fingerprint": "493382002d08a752"
    },
    {
      "version_id": "走-expr-story-v1",
      "item_id": "走-expr-story",
      "kind": "expression",
      "version_no": 1,
      "payload": {
        "text": "看这个字，像不像一个人甩开手臂大步跑？古时候“走”就是“快跑”哦！",
        "age_band": "4-6"
      },
      "source_refs": [
        {
          "source_id": "SRC-001",
          "note": "字形描述依据"
        },
        {
          "source_id": "SRC-006",
          "note": "适龄改写依据"
        }
      ],
      "author": "内容组",
      "state": "已发布",
      "review": {
        "reviewer": "外聘文字学专家",
        "note": ""
      },
      "fingerprint": "e1c4edac6fc53005"
    },
    {
      "version_id": "走-img-ding-v1",
      "item_id": "走-img-ding",
      "kind": "image",
      "version_no": 1,
      "payload": {
        "asset_ref": "影像库/DING-ZOU-01.tif",
        "caption": "西周青铜鼎铭文中的“走”字（金文）"
      },
      "source_refs": [
        {
          "source_id": "SRC-005",
          "note": "馆藏影像"
        }
      ],
      "author": "内容组",
      "state": "已发布",
      "review": null,
      "fingerprint": "5f302cb3f67432fe"
    },
    {
      "version_id": "走-img-rubbing-v1",
      "item_id": "走-img-rubbing",
      "kind": "image",
      "version_no": 1,
      "payload": {
        "asset_ref": "影像库/RUB-ZOU-02.png",
        "caption": "拓印体验用“走”字金文底图"
      },
      "source_refs": [
        {
          "source_id": "SRC-005",
          "note": "馆藏影像"
        }
      ],
      "author": "内容组",
      "state": "需更换",
      "review": null,
      "fingerprint": "9ef3044a43f4eda1"
    },
    {
      "version_id": "走-glyph-seal-v2",
      "item_id": "走-glyph-seal",
      "kind": "glyph",
      "version_no": 2,
      "payload": {
        "script_form": "小篆",
        "period": "秦（公元前221年统一后定型）",
        "glyph_ref": "〔小篆：上“夭”下“止”，线条匀圆〕"
      },
      "source_refs": [
        {
          "source_id": "SRC-003",
          "note": "《说文》成书年代订正"
        }
      ],
      "author": "内容组",
      "state": "已发布",
      "review": {
        "reviewer": "外聘文字学专家",
        "note": ""
      },
      "fingerprint": "761fd627a1ea0c33"
    },
    {
      "version_id": "走-img-rubbing-v2",
      "item_id": "走-img-rubbing",
      "kind": "image",
      "version_no": 2,
      "payload": {
        "asset_ref": "影像库/JIAN-ZOU-03.png",
        "caption": "秦简“走”字特写，替代撤权底图"
      },
      "source_refs": [
        {
          "source_id": "SRC-005",
          "note": "馆藏影像"
        }
      ],
      "author": "内容组",
      "state": "已发布",
      "review": null,
      "fingerprint": "9f4680c27aff81e6"
    },
    {
      "version_id": "走-expr-access-10-v1",
      "item_id": "走-expr-access-10",
      "kind": "expression",
      "version_no": 1,
      "payload": {
        "title": "走·触觉讲解版",
        "text": "请伸出手臂：上面像甩开的双臂，下面是一只脚——整个人在奔跑。可配合让孩子摸一摸拓片上奔跑的人形。",
        "age_band": "4-6",
        "accessibility": true
      },
      "source_refs": [
        {
          "source_id": "SRC-006",
          "note": "触觉通道表达依据"
        }
      ],
      "author": "内容组",
      "state": "已发布",
      "review": {
        "reviewer": "外聘文字学专家",
        "note": ""
      },
      "fingerprint": "8745ec9d04d47dac"
    }
  ],
  "licenses": [
    {
      "license_id": "LIC-001",
      "image_version_id": "走-img-ding-v1",
      "licensor": "本馆影像部",
      "scope": [
        "展陈印刷",
        "出版物",
        "互动活动",
        "数字展示"
      ],
      "valid_from": "2026-01-01",
      "valid_until": "2027-12-31",
      "document_ref": "授权协议字第2026-017号",
      "status": "有效",